{
  "schemaVersion": 1,
  "fidelity": "canon",
  "id": "flame",
  "displayName": "The Flame",
  "sprite": "flame",
  "size": { "w": 16, "h": 16 },
  "collisionBox": { "x": -6, "y": -12, "w": 12, "h": 12 },
  "speed": { "xFp": 256, "yFp": 256 },
  "lingerTicks": 512,
  "lifeTicks": 1024,
  "steerTicks": 256,
  "homingPer10k": 5000,
  "spawnInsetPx": 24
}
